{
  "protocol_version": 1,
  "request_id": "018f3f4a-2d9b-7d21-a310-2c49d9b43c11",
  "message_kind": "response",
  "capability": "system.capabilities",
  "deadline_ms": 1000,
  "payload": {
    "screen_capture": "available",
    "permissions": {
      "screen_capture": "granted",
      "accessibility": "granted",
      "camera": "not_determined",
      "microphone": "denied"
    }
  },
  "error": null
}
